{
  "schemaVersion": "1.0.0",
  "contentVersion": "review-repair-352e7c6af3ff49cc",
  "updatedAt": "2026-10-01T16:25:00Z",
  "sourceSnapshot": "voyage-tw-2026052501",
  "auditStatus": "unverified",
  "auditNotes": "本批對合併正式集合執行嚴格 Schema、外鍵、唯一性、技能等級與解鎖、天生效果及實際計數校驗；依已有 sk2／修理分類映射證據修正兩筆自訂關係為主動。未有映射證據的關係保留待複核，未宣稱所有主被動分類均已人工確認。",
  "counts": {
    "officers": 639,
    "skills": 1209,
    "assets": 15,
    "dictionaryItems": 600,
    "tradeGoods": 656,
    "tradePorts": 224,
    "tradeSeasonProfiles": 10
  }
}
